tweet,clase real,clase predicha
biolog inequ,cyberbullying,not_cyberbullying
whoa nice uh impress celin,cyberbullying,not_cyberbullying
true,cyberbullying,not_cyberbullying
omg wait tri hard crazi eye kat amp douch bag go home cheat anymor guess b soon,cyberbullying,not_cyberbullying
continu product carbon dioxid,cyberbullying,not_cyberbullying
one bottom pic feminazi tumblr fag,cyberbullying,not_cyberbullying
exactli cult death center around idea go heaven describ giant whore hous,cyberbullying,not_cyberbullying
drasco u chef wanka one day miss ask self fuck dick,cyberbullying,not_cyberbullying
true scotsman,cyberbullying,not_cyberbullying
ahh christian conspiraci book involv real christian action unnot irrelev,not_cyberbullying,cyberbullying
bellevil hate harbaugh caus process player school,cyberbullying,not_cyberbullying
protip think stalk rape joke funni fit enforc appli want,not_cyberbullying,cyberbullying
man stop babbl squirm admit wrong,cyberbullying,not_cyberbullying
oh shock face kat realli,cyberbullying,not_cyberbullying
could care less much love fraud right think way want express,cyberbullying,not_cyberbullying
good job call loser btw hypocrisi gold hope someon see,cyberbullying,not_cyberbullying
way insult direct man unflatt hat worn predominantli men meant in,cyberbullying,not_cyberbullying
hit way wear would ok,cyberbullying,not_cyberbullying
first hand account now founder sister bs,cyberbullying,not_cyberbullying
sassi like trashi,cyberbullying,not_cyberbullying
parent put kid tour christma ornament awkward elementari school pictur,not_cyberbullying,cyberbullying
idgaf shoy wear caus nigga look buh finna stop ha look bad asl,cyberbullying,not_cyberbullying
equanim mean calm content stop redefin word still know point,cyberbullying,not_cyberbullying
video supposedli show shia militia kill solid call kaka mean mr kurdish gone viral among,cyberbullying,not_cyberbullying
er probabl repeatedli school,cyberbullying,not_cyberbullying
forc drop school amid bulli say want terribl,not_cyberbullying,cyberbullying
actual one face wide flat front townhous easi mistak make,cyberbullying,not_cyberbullying
ugh fake nerd guy even know wonder woman,not_cyberbullying,cyberbullying
give kid name like ask bulli school,not_cyberbullying,cyberbullying
feel like incomplet much unimpo think best get arc rei tri help hina fit school struggl think would far reward narr shoe horn bulli,cyberbullying,not_cyberbullying
herd got bulli year old feel bad ok,cyberbullying,not_cyberbullying
one school pick class peopl like watch magician bulli juggler jeff winger,cyberbullying,not_cyberbullying
alreadi proven islam abus women amp show statist back bore repetit,cyberbullying,not_cyberbullying
wrong asshol look christian vs muslim popul demograph last year,not_cyberbullying,cyberbullying
kind want jump tv punch kat face hope contest vote strateg,cyberbullying,not_cyberbullying
big educ ape end homophob bulli michel rhee speak church confer despit anti gay alleg,not_cyberbullying,cyberbullying
wast time kelli will stab million women back pc,cyberbullying,not_cyberbullying
mean disrespect girl much difficult coach boy,cyberbullying,not_cyberbullying
fool see photoshop job goat fucker,cyberbullying,not_cyberbullying
red dress pink si much better,cyberbullying,not_cyberbullying
want go home pleas mr roug k call function process ge,not_cyberbullying,cyberbullying
see young angri feminist much better age make hea swell,not_cyberbullying,cyberbullying
undoubtedli jerk cock everi new blumenth tweet,cyberbullying,not_cyberbullying
girl realli put ass sass,cyberbullying,not_cyberbullying
issa bad bitch,cyberbullying,not_cyberbullying
happen friend car rebecca black drop school blame bulli,not_cyberbullying,cyberbullying
care grade like elementari school aaa bulli,not_cyberbullying,cyberbullying
sexist sexist sexist oh wait whoa whoa whoa know n,not_cyberbullying,cyberbullying
put women room lawwwwd know could happen,cyberbullying,not_cyberbullying
see fire men make excus murder seven innoc women,not_cyberbullying,cyberbullying
swore raven gonna whoop ass jj watt gonna destroy line lol,not_cyberbullying,cyberbullying
defin forc,cyberbullying,not_cyberbullying
think dess refin beauti wonder think pretti,cyberbullying,not_cyberbullying
good luck,cyberbullying,not_cyberbullying
legit stupid troll,cyberbullying,not_cyberbullying
join pay,cyberbullying,not_cyberbullying
wonder kat ask everyon bum durri,cyberbullying,not_cyberbullying
news flash think femin fuckal men go ahead unfollow right let door hit etc,not_cyberbullying,cyberbullying
new jersey school us toughest anti bulli law page requir leagu tabl,not_cyberbullying,cyberbullying
dont ever let women drive break arm,cyberbullying,not_cyberbullying
islam kill,cyberbullying,not_cyberbullying
follow pathet low amount femal engin cool femal repoer,not_cyberbullying,cyberbullying
lost crowd fund caus choos battl,cyberbullying,not_cyberbullying
like serious get one racist sexist fuckwad leadership posit today,not_cyberbullying,cyberbullying
ladi unlik drug alway share hooker,cyberbullying,not_cyberbullying
defens gender bias prison system,cyberbullying,not_cyberbullying
keep comin get view hate nigga dat tri get dat bulli shit make self look good,not_cyberbullying,cyberbullying
remind harshli women boss truli suck,cyberbullying,not_cyberbullying
marni think hotter school wear black,not_cyberbullying,cyberbullying
let bratti teenag bulli wanna pick gonna see dean school,cyberbullying,not_cyberbullying
thompson school district new websit suppo commun deal bulli cyberbulli check,not_cyberbullying,cyberbullying
last week school much work actual abl graduat see twitter daylight hour pleas bulli app,cyberbullying,not_cyberbullying
peopl work hard make world better place other work hard book drink sex pay,cyberbullying,not_cyberbullying
lgbtq muslim happi jealou jealou,cyberbullying,not_cyberbullying
bulli win school yard,cyberbullying,not_cyberbullying
complain islam ethnic cleans everybodi year time return favor,cyberbullying,not_cyberbullying
chicago homicid victim past decad black polic data show sta home peopl good mob countri even run life home pretti simpl none us owe anyth work,cyberbullying,not_cyberbullying
idea go zone right wing boogi man stupid go zone real,cyberbullying,not_cyberbullying
play hang man one statement one girl school stank time lol bet everybodi know,not_cyberbullying,cyberbullying
bulli climat school may link lower test score,not_cyberbullying,cyberbullying
saudi sewer quran perfect idea perfect place quran,cyberbullying,not_cyberbullying
gay teen sue minnesota school district bulli polici via,not_cyberbullying,cyberbullying
toto mean ass vagina think pussi caus toto santi like nasti pussi,cyberbullying,not_cyberbullying
socialist moslem work togeth destroy australia,cyberbullying,not_cyberbullying
nikki pout annoy readi wipe kick show,cyberbullying,not_cyberbullying
one cut head sell slaveri thing happen ir take propey,cyberbullying,not_cyberbullying
first bandera fought nazi also nazi prison,not_cyberbullying,cyberbullying
thirsti vagina warrior name new girl band old girl band bulli pulpit trial balloon broke,not_cyberbullying,cyberbullying
muslim want wipe face eah,cyberbullying,not_cyberbullying
honest like harass easi target bulli middl school,cyberbullying,not_cyberbullying
tag refer,cyberbullying,not_cyberbullying
anoth thing u realiz post joke mock post see black hist,not_cyberbullying,cyberbullying
richard ii nobodi prophet microbrain excus crime islam use other crime,not_cyberbullying,cyberbullying
need give david million guess,cyberbullying,not_cyberbullying
id love turn around tell ladi shut cuz way boss husband around super annoyi,cyberbullying,not_cyberbullying
eva amp debra hate team least night ep snake grass two,cyberbullying,not_cyberbullying
compuls religion unless kid cours,cyberbullying,not_cyberbullying
repeatedli told peopl call stupid though,not_cyberbullying,cyberbullying
think pink undi skank meth teeth ever cook anyth,cyberbullying,not_cyberbullying
apolog clear think statement equal racist origin tweet sexist,not_cyberbullying,cyberbullying
guess time learn racism islam,cyberbullying,not_cyberbullying
one reason south korea well muslim countri impoverish authoritarian sewer,not_cyberbullying,cyberbullying
u need peopl like u point ur finger say hey bad guy,not_cyberbullying,cyberbullying
amp gone alway hoe,cyberbullying,not_cyberbullying
like cool bulli selena fuck bitch,not_cyberbullying,cyberbullying
believ equal except drunk mad women lt trust male feminist,not_cyberbullying,cyberbullying
close need one conan brien morph toni big hu,cyberbullying,not_cyberbullying
e lead shut badal school backward area amp parent mostli allow join far away school,not_cyberbullying,cyberbullying
karma kat,cyberbullying,not_cyberbullying
manu sass kat favourit thing ever,cyberbullying,not_cyberbullying
sexist men skill set abil leagu women much enteain,cyberbullying,not_cyberbullying
insult prophet call women stupid,not_cyberbullying,cyberbullying
top tweet resurrect current privat yacht feminazi retweet math,cyberbullying,not_cyberbullying
fuck school imma marri rich nigga ion shit forreal,not_cyberbullying,cyberbullying
religion gunpoint allegi gun point,cyberbullying,not_cyberbullying
white feminist need focu call men higher posit power let keep focu,not_cyberbullying,cyberbullying
listen especi children bulli harrass school sympathet ear,not_cyberbullying,cyberbullying
good luck,cyberbullying,not_cyberbullying
paint other inhuman exactli quran non believ,cyberbullying,not_cyberbullying
kat elimin bad sposmanship,cyberbullying,not_cyberbullying
never hit woman kat realli realli push boundari ugli fuck mole,not_cyberbullying,cyberbullying
repo mosul lot muslim turn atheist result way isi forc religion,not_cyberbullying,cyberbullying
lmfao stole ur girl u put bulli beatdown,not_cyberbullying,cyberbullying
read face terrorist,cyberbullying,not_cyberbullying
see gf week real stuff,cyberbullying,not_cyberbullying
best time worst time amaz tit gotta say,cyberbullying,not_cyberbullying
attn ladi agent bulli stand urself make money way around gonna shake thing,not_cyberbullying,cyberbullying
cannot stop look nikki dread black crook bra,cyberbullying,not_cyberbullying
think worst women shame women shave know exactli much pain doubl standard smh,not_cyberbullying,cyberbullying
idiot complet extermin major arabian pennisula,not_cyberbullying,cyberbullying
anybodi suppo process basic inform need,cyberbullying,not_cyberbullying
jedward take stand bulli power campaign caption discourag bulli encourag toler,not_cyberbullying,cyberbullying
show petti school bulli,cyberbullying,not_cyberbullying
hope kat cat andr lose leav show kat nasti piec work win fairli,cyberbullying,not_cyberbullying
missu love watch five minut stuck idiot bit hooker neck,cyberbullying,not_cyberbullying
fuhermor hero taliban respons murder afghan civilian stick asshol,cyberbullying,not_cyberbullying
mayb girl go back cut cow pig quit day job,cyberbullying,not_cyberbullying
cant get girl much xma year day school left never want nethang long live,not_cyberbullying,cyberbullying
face excus self righteou son bitch oh worri refer mo,cyberbullying,not_cyberbullying
australia tax money help financ countri destruct terrorist sa,cyberbullying,not_cyberbullying
yeap much bandwidth self genocid jew blumenth turn center attent,cyberbullying,not_cyberbullying
crumbl curd cream descript girl dess also reaction collin inevit scath review,cyberbullying,not_cyberbullying
slaveri program done turn nation muslim anyth els think,not_cyberbullying,cyberbullying
patriarchi myth system push back amp feminist use chivalri amp benevol sexism master end,cyberbullying,not_cyberbullying
sharia put muslim world year behind rest civil tour minor,cyberbullying,not_cyberbullying
buy bulk,cyberbullying,not_cyberbullying
manu beauti,cyberbullying,not_cyberbullying
sexist men women,not_cyberbullying,cyberbullying
oh muslim get involv thing must desper ye read news pa bbc chaer naga munchetti say broadcast robot idiot via,cyberbullying,not_cyberbullying
novel color lieuten fervent effo withstand hostil racism u armi,cyberbullying,not_cyberbullying
kid said deconstruct yeh seen better shit women magazi oh right sorri,cyberbullying,not_cyberbullying
repeatedli call woman bitch stage pa crunchi problem women,not_cyberbullying,cyberbullying
murder muslim everi day way isi keep control,not_cyberbullying,cyberbullying
idiot conv islam point,not_cyberbullying,cyberbullying
need inflat rape statist money grab would cheer,cyberbullying,not_cyberbullying
blog difficult convers process rape trigger warn,not_cyberbullying,cyberbullying
women ok tell woman dress oh wait tick,cyberbullying,not_cyberbullying
oh god someon punch kat face,cyberbullying,not_cyberbullying
school taught us anyth text without look,not_cyberbullying,cyberbullying
tv host nobodi dare admit isi crime base islam sourc egypt honest,cyberbullying,not_cyberbullying
colleg tribun appli attend school,cyberbullying,not_cyberbullying
need femisnn heard femist tri write book sequel call mock meningbird,not_cyberbullying,cyberbullying
act like grade school wimp hide behind bulli scheer huge disappoint bad,cyberbullying,not_cyberbullying
like two bulli school look see someth disgrac enough,cyberbullying,not_cyberbullying
nigga need anger manag,cyberbullying,not_cyberbullying
hitler bihday like iron shit holi fuck believ twitter oke usernam sexist fuck,not_cyberbullying,cyberbullying
lmao u fuck imagin yike,not_cyberbullying,cyberbullying
nigga look like odb first goy outta high school,not_cyberbullying,cyberbullying
theme instant restaur appear barbi dream narciss kitchen,cyberbullying,not_cyberbullying
peopl want kill apost suppo jihad suppo sexism suppo sharia peopl scum,not_cyberbullying,cyberbullying
women never paicip shave novemb hair head,cyberbullying,not_cyberbullying
suck smile wipe face huh kat glass hous throw stone,cyberbullying,not_cyberbullying
hope kat get ebola hit train follow smack ugli face shovel,cyberbullying,not_cyberbullying
go wash dish make someth delici eat,cyberbullying,not_cyberbullying
sexist hous fire better finish dish dear,cyberbullying,not_cyberbullying
bulli school keep make friend,cyberbullying,not_cyberbullying
find peopl claim other know anyth islam know anyth,not_cyberbullying,cyberbullying
school made us dispos swim diaper reusabl one doubl diaper call,not_cyberbullying,cyberbullying
long sleev checker polo super skinni jean super high heel classic,not_cyberbullying,cyberbullying
tokyo hot n endless sex drive,cyberbullying,not_cyberbullying
terrorist differ isi pamplet amp quran,cyberbullying,not_cyberbullying
muslim anti christian fine jewish anti christian offens,not_cyberbullying,cyberbullying
said everyon high school,not_cyberbullying,cyberbullying
sure use get fight bulli school beat instead gt,cyberbullying,not_cyberbullying
aim,cyberbullying,not_cyberbullying
let pray whole world violenc racism bulli homophobia,not_cyberbullying,cyberbullying
tri make habit respond conspiraci theori one funni share,not_cyberbullying,cyberbullying
comment ford thing complain,cyberbullying,not_cyberbullying
piec camera record event kat know get smack still gloat like crazi bond villain,cyberbullying,not_cyberbullying
tenni neutral set joke,cyberbullying,not_cyberbullying
show exampl,cyberbullying,not_cyberbullying
r real color ppl lol n photo cut amp past n w sign u photoshop w,cyberbullying,not_cyberbullying
ye kat andr unsposmanlik even score like everyon els bimbo still got,cyberbullying,not_cyberbullying
pay know walk way w pay think might drive bit safer understand,cyberbullying,not_cyberbullying
know forc sexism hatr bigotri popul islamolunat,cyberbullying,not_cyberbullying
design much poorer set incent,cyberbullying,not_cyberbullying
fo woh son went school polic offic school gun free zone shooter dream,not_cyberbullying,cyberbullying
lot school visit resembl prison visit minu bar hmmmmm,not_cyberbullying,cyberbullying
forc flavor religion anyon make bad guy twitter handl islam declar war human,not_cyberbullying,cyberbullying
muslim produc thoma jefferson mahatma ghandi produc freedom democraci,cyberbullying,not_cyberbullying
anoth exampl comment femal foss dev get regular basi like code insult appear,cyberbullying,not_cyberbullying
mindsur first one swear,cyberbullying,not_cyberbullying
bitch,cyberbullying,not_cyberbullying
even annoy exist past high school,not_cyberbullying,cyberbullying
pleas explain figur cite wage gap discuss compar thank,cyberbullying,not_cyberbullying
colleg tribun appli attend school,cyberbullying,not_cyberbullying
arm ezidi around daesh began slaughter enslav cri,cyberbullying,not_cyberbullying
must sting spo fan ask vagina american comment despit inher genet superior eh,not_cyberbullying,cyberbullying
asshol chang fact muslim forc convers never stop,not_cyberbullying,cyberbullying
scabi celebr open bulli experi new book dont peak high school,not_cyberbullying,cyberbullying
impress madrassa rat baghdadi phd islam tell,not_cyberbullying,cyberbullying
ceain thread,cyberbullying,not_cyberbullying
feminazi xd,cyberbullying,not_cyberbullying
piec shit like everyth power extermin white peopl,cyberbullying,not_cyberbullying
entir nation saudi punnish sinc allow church bibl,cyberbullying,not_cyberbullying
bitch boosi bad ass time fight show,cyberbullying,not_cyberbullying
stop use fuck live matter tag sit shut read listen black voic end,not_cyberbullying,cyberbullying
new chant outsid diwan tahawi zarqawi want execut al rishawi,cyberbullying,not_cyberbullying
tri find someth pretti blond idiot,cyberbullying,not_cyberbullying
boooo whore,cyberbullying,not_cyberbullying
ugh summer almost wanna go school bulli everi day,not_cyberbullying,cyberbullying
want go home pleas mr roug k,cyberbullying,not_cyberbullying
feed littl piec taqiyya bs,cyberbullying,not_cyberbullying
atla stop school bulli teas olivia,cyberbullying,not_cyberbullying
hh must watch video,cyberbullying,not_cyberbullying
whole school bulli,cyberbullying,not_cyberbullying
could care less much love fraud right think way want express,cyberbullying,not_cyberbullying
women rule world would war bunch countri talk,cyberbullying,not_cyberbullying
true stone behead much moham tast,cyberbullying,not_cyberbullying
memo presid obama jihad lead crusad polit islam break jihad l,not_cyberbullying,cyberbullying
white hous refus call behead victim christian egypt launch airstrik islam state,not_cyberbullying,cyberbullying
class nigga df,cyberbullying,not_cyberbullying
mission school undercov bulli stale theo got piss hell,cyberbullying,not_cyberbullying
prove dumb blond pretti face whatev,not_cyberbullying,cyberbullying
like video male right activist own feminazi,cyberbullying,not_cyberbullying
crucifixion stone behead shoot throw build isi orgi sadist gruesom method murder,cyberbullying,not_cyberbullying
whoa nice uh impress celin,cyberbullying,not_cyberbullying
churn babi churn,cyberbullying,not_cyberbullying
question u condemn terror youth amp thing taught stop cri,cyberbullying,not_cyberbullying
serious crazi eye stay,cyberbullying,not_cyberbullying
idiot work document multipl sourc european muslim oromo oral tradit ethiopian histori alter version think true good despic mindless peopl actual good,cyberbullying,not_cyberbullying
call dumb fell bullshit also quot one women abus,not_cyberbullying,cyberbullying
absolut truth verifi hundr sourc anti semit script propaganda,cyberbullying,not_cyberbullying
honestli sure lot ck school realli bulli,cyberbullying,not_cyberbullying
kat attitud think time keep score quiet final round,cyberbullying,not_cyberbullying
ja move jamica fuck nigger,cyberbullying,not_cyberbullying
would know would nt recogn logic fell total idiot would suppo one side pacificim,not_cyberbullying,cyberbullying
top suppos devil worship live peac allah worship act like devil,not_cyberbullying,cyberbullying
legal oblig repo think,cyberbullying,not_cyberbullying
lol common knowledg countless repo muslim go area europ googl,cyberbullying,not_cyberbullying
hope upcom freshman bestfrann gonna lose bitch hit high school door lmao,not_cyberbullying,cyberbullying
definit islam hatr neg get rid cancer civil advanc,cyberbullying,not_cyberbullying
r real color ppl lol n photo cut amp past n w sign u photoshop w,cyberbullying,not_cyberbullying
still go strong eventu devolv pic hot women pam carmen etc,cyberbullying,not_cyberbullying
ye isi defam islam follow letter,cyberbullying,not_cyberbullying
